sha,filename,url,lines,title,comment,priority,category,additional,id,private
"41a0513d25fae7a8980305fe20a30e3d5938507b","\src\data\data.controller.ts","","70:2-72:13","Test inutile","Tu ne dois pas tester si dataId est présetn mais si data existe avec la dataId, comme dans getByID","0","Architecture","","179d449c-cc03-4d3b-bf0b-e8d64025a158","0"
"41a0513d25fae7a8980305fe20a30e3d5938507b","\src\app.service.ts","","5:22-6:26","fichiers inutiles","SI les fichiers ne servent à rien supprime les ","0","Best Practices","","7dbd19cb-da43-400c-b27e-3d053ab37040","0"
"41a0513d25fae7a8980305fe20a30e3d5938507b","\src\app.controller.ts","","1:0-13:0","fichier inutile","suppression des fihciers inutiles","0","Best Practices","","12073d7b-55e0-4d85-95db-e15ad9397fa8","0"
"","\ms-datashare\src\share\share.service.ts","","144:20-144:55","no need body","Ici encapsuler l'objet dans body ne sert à rien. IL faut typer ton entré de fonction indépendamment de la fonction qui va l'appeler. ici ça se voit que tu adaptes à ton objet ","0","Best Practices","","048a0806-52d1-4ab1-9f27-e649e224c680","0"
"","\ms-datashare\src\share\share.controller.ts","","98:1-110:14","à simplifier","tu n'as pas besoin du dernier map tu peux le faire depuis le 1er je chipote mais ça ocmplexifie la lecture ton algo ","0","Code-Style","","3bac3033-7f7a-4068-92df-6a1b97d8fb46","0"
